{"$defs":{"criterion":{"additionalProperties":false,"properties":{"comparator":{"enum":["eq","ne","lt","lte","gt","gte","between","contains"]},"expected":{"maxLength":1024,"type":["string","number","integer","boolean"]},"id":{"pattern":"^[a-z0-9][a-z0-9._-]{0,127}$","type":"string"},"observation_class":{"maxLength":128,"minLength":1,"type":"string"},"unit":{"maxLength":64,"minLength":1,"type":"string"}},"required":["id","observation_class","comparator","expected","unit"],"type":"object"},"decision_map_ref":{"$ref":"#/$defs/ref","properties":{"kind":{"const":"decision_map"}}},"digest":{"pattern":"^[a-f0-9]{64}$","type":"string"},"document_schema":{"additionalProperties":false,"properties":{"id":{"const":"https://agent-ops.ru/schemas/foundation_operational_intent.schema.json"},"media_type":{"const":"application/schema+json"},"sha256":{"$ref":"#/$defs/digest"},"version":{"const":"1.0.0"}},"required":["id","version","sha256","media_type"],"type":"object"},"evidence_ref":{"$ref":"#/$defs/ref","properties":{"kind":{"enum":["evidence_record","evidence_bundle"]}}},"intent_ref":{"$ref":"#/$defs/ref","properties":{"kind":{"const":"operational_intent"}}},"outcome_ref":{"$ref":"#/$defs/ref","properties":{"kind":{"const":"outcome_check"}}},"owner_ref":{"$ref":"#/$defs/ref","properties":{"kind":{"const":"owner"}}},"ref":{"additionalProperties":false,"properties":{"id":{"maxLength":128,"minLength":1,"type":"string"},"kind":{"enum":["project","environment","service","owner","runbook","policy","tool_contract","evidence_record","evidence_bundle","operational_intent","decision_map","human_decision","discovery_assessment","outcome_check"]},"namespace":{"maxLength":512,"minLength":8,"type":"string"},"version":{"maxLength":32,"pattern":"^(0|[1-9][0-9]*)\\.(0|[1-9][0-9]*)\\.(0|[1-9][0-9]*)$","type":"string"}},"required":["kind","namespace","id","version"],"type":"object"},"scope":{"additionalProperties":false,"properties":{"environment_refs":{"items":{"$ref":"#/$defs/ref"},"maxItems":64,"type":"array","uniqueItems":true},"project_ref":{"$ref":"#/$defs/ref"},"service_refs":{"items":{"$ref":"#/$defs/ref"},"maxItems":256,"type":"array","uniqueItems":true}},"required":["project_ref"],"type":"object"},"text":{"maxLength":4096,"minLength":1,"type":"string"},"text_set":{"items":{"maxLength":1024,"minLength":1,"type":"string"},"maxItems":64,"type":"array","uniqueItems":true},"time_window":{"additionalProperties":false,"properties":{"end":{"format":"date-time","type":"string"},"start":{"format":"date-time","type":"string"}},"required":["start","end"],"type":"object"}},"$id":"https://agent-ops.ru/schemas/foundation_operational_intent.schema.json","$schema":"https://json-schema.org/draft/2020-12/schema","additionalProperties":false,"properties":{"assumptions":{"$ref":"#/$defs/text_set"},"author_ref":{"$ref":"#/$defs/owner_ref"},"authorship_attestation_ref":{"$ref":"#/$defs/evidence_ref"},"baseline":{"$ref":"#/$defs/text"},"constraints":{"$ref":"#/$defs/text_set"},"decision_map_ref":{"$ref":"#/$defs/decision_map_ref"},"document_schema":{"$ref":"#/$defs/document_schema"},"expected_outcome":{"$ref":"#/$defs/text"},"falsification_criteria":{"items":{"$ref":"#/$defs/criterion"},"maxItems":64,"minItems":1,"type":"array"},"format_version":{"const":"1.0.0"},"measurable_targets":{"items":{"$ref":"#/$defs/criterion"},"maxItems":64,"minItems":1,"type":"array"},"objective":{"$ref":"#/$defs/text"},"outcome_hypothesis":{"$ref":"#/$defs/text"},"owner_ref":{"$ref":"#/$defs/owner_ref"},"parent_ref":{"$ref":"#/$defs/intent_ref"},"prohibited_actions":{"items":{"maxLength":256,"minLength":1,"type":"string"},"maxItems":64,"minItems":1,"type":"array","uniqueItems":true},"ref":{"$ref":"#/$defs/intent_ref"},"required_outcome_check":{"$ref":"#/$defs/outcome_ref"},"scope":{"$ref":"#/$defs/scope"},"stakeholder_refs":{"items":{"$ref":"#/$defs/owner_ref"},"maxItems":64,"minItems":1,"type":"array","uniqueItems":true},"time_window":{"$ref":"#/$defs/time_window"}},"required":["format_version","document_schema","ref","author_ref","owner_ref","authorship_attestation_ref","objective","expected_outcome","baseline","measurable_targets","outcome_hypothesis","stakeholder_refs","assumptions","falsification_criteria","time_window","scope","constraints","prohibited_actions","required_outcome_check","decision_map_ref"],"title":"Gitinsky Foundation Operational Intent Authored Document","type":"object"}
